{
  "observations": [
    {
      "ad_fingerprint": "1e80bc78b77a8e932219a826bc3ac61a3a6e76740130990309083a7404656608",
      "advertiser_name": "Augment Code",
      "body": "Cosmos is multi-model by default.",
      "claims": [
        "Cursor alternative"
      ],
      "countries": [
        "US"
      ],
      "creative_hash": null,
      "creative_type": "text",
      "creative_url": null,
      "cta": "Learn more",
      "event_type": "ad_seen",
      "headline": "Cursor Alternative: Cosmos",
      "landing_domain": "www.augmentcode.com",
      "landing_url": "https://www.augmentcode.com/",
      "notes": "Observed in Google Ads Transparency Center assisted domain scan card. Evidence: marketing/creatives/google/augment-code/20260707T220758Z-augmentcode-google-domain.png.",
      "observed_at": "2026-07-07T22:11:00Z",
      "platform": "google",
      "platform_ad_id": null,
      "positioning_tags": [
        "positioning"
      ],
      "product_id": "augment-code",
      "raw_ref": "marketing/scans/20260707T220758Z/google/augment-code.raw.json",
      "scan_id": "20260707T220758Z",
      "source_url": "https://adstransparency.google.com/?region=US&domain=augmentcode.com",
      "status": "active"
    },
    {
      "ad_fingerprint": "5dc8514f3ae1d98e5ff43584462ad44142da6abf7ec38403fa5f5ef457d907b1",
      "advertiser_name": "Augment Code",
      "body": "A fleet of agents reviews every PR.",
      "claims": [
        "agentic code review"
      ],
      "countries": [
        "US"
      ],
      "creative_hash": null,
      "creative_type": "text",
      "creative_url": null,
      "cta": "Learn more",
      "event_type": "ad_seen",
      "headline": "End 20-Hour PR Reviews - Agentic Code Review",
      "landing_domain": "www.augmentcode.com",
      "landing_url": "https://www.augmentcode.com/",
      "notes": "Observed in Google Ads Transparency Center assisted domain scan; screenshot shows approximately 700 ads for augmentcode.com. Evidence: marketing/creatives/google/augment-code/20260707T220758Z-augmentcode-google-domain.png.",
      "observed_at": "2026-07-07T22:11:00Z",
      "platform": "google",
      "platform_ad_id": null,
      "positioning_tags": [
        "enterprise-governance",
        "review_shipping"
      ],
      "product_id": "augment-code",
      "raw_ref": "marketing/scans/20260707T220758Z/google/augment-code.raw.json",
      "scan_id": "20260707T220758Z",
      "source_url": "https://adstransparency.google.com/?region=US&domain=augmentcode.com",
      "status": "active"
    },
    {
      "ad_fingerprint": "c814adaeba0bcf7e071eb93ad55fb7d218b8e5678c7b595bb2be98d9d237e8dc",
      "advertiser_name": "Augment Code",
      "body": "Agents handle incidents faster now.",
      "claims": [
        "incident response"
      ],
      "countries": [
        "US"
      ],
      "creative_hash": null,
      "creative_type": "text",
      "creative_url": null,
      "cta": "Learn more",
      "event_type": "ad_seen",
      "headline": "Cosmos Incident Response - 5x Faster Root Cause",
      "landing_domain": "www.augmentcode.com",
      "landing_url": "https://www.augmentcode.com/",
      "notes": "Observed in Google Ads Transparency Center assisted domain scan card. Evidence: marketing/creatives/google/augment-code/20260707T220758Z-augmentcode-google-domain.png.",
      "observed_at": "2026-07-07T22:11:00Z",
      "platform": "google",
      "platform_ad_id": null,
      "positioning_tags": [
        "enterprise-governance"
      ],
      "product_id": "augment-code",
      "raw_ref": "marketing/scans/20260707T220758Z/google/augment-code.raw.json",
      "scan_id": "20260707T220758Z",
      "source_url": "https://adstransparency.google.com/?region=US&domain=augmentcode.com",
      "status": "active"
    }
  ],
  "observed_at": "2026-07-07T22:11:00Z",
  "platform": "google",
  "product_id": "augment-code",
  "scan_id": "20260707T220758Z",
  "schema_version": "0.1"
}
